
[29/07/21 16:12:40] **Pau Fitz:** Pediatra 11 am

[29/07/21 16:15:45] **Alfonso Alvarez:** Cuando?

[29/07/21 16:17:03] **Pau Fitz:** 12:15 Cita miércoles 25 agosto tamiz auditivo hospital h+ Torre 2

[29/07/21 16:17:13] **Pau Fitz:** Perdón no tenia donde anotar, es el sábado

[29/07/21 16:23:10] **Pau Fitz:** Dra Rivera H+ Torre 3 piso 6 sábado 7 agosto 11:30 am $1000 
Tamiz visual

[29/07/21 16:25:26] **Alfonso Alvarez:** Ah ok 🤓

[30/07/21 12:36:15] **Alfonso Alvarez:** Ya le estoy preparando la mamila y estamos bien amor, disfruta 😘😘

[30/07/21 12:38:54] **Pau Fitz:** Que bueno Justo te iba a marcar, ok te amo

[30/07/21 12:39:38] **Pau Fitz:** Gracias mi amor

[30/07/21 15:16:30] **Alfonso Alvarez:** A donde vas?? Regresa x favor

[30/07/21 15:16:39] **Alfonso Alvarez:** No manejes así

[30/07/21 15:17:31] **Alfonso Alvarez:** Xq no podemos hablar como adultos??

[30/07/21 15:24:34] **Alfonso Alvarez:** No hagas esto más grande y regresa x favor!! Lo único q me hace falta eres tú y ya t lo dije d mil maneras

[30/07/21 16:37:03] **Pau Fitz:** ‎Missed voice call

[31/07/21 19:59:23] **Pau Fitz:** Cualquier cosa me avisas

[31/07/21 20:00:22] **Alfonso Alvarez:** Si amor tranquila 😘

[01/08/21 9:30:44] **Alfonso Alvarez:** 4422411473
Los potros

‎[02/08/21 9:34:02] **Pau Fitz:** ‎<attached: 00000140-PHOTO-2021-08-02-09-34-02.jpg>

[02/08/21 13:43:20] **Pau Fitz:** Se me olvidó anotar el agua termal en spray para la 👶🏽

[02/08/21 14:12:23] **Alfonso Alvarez:** 👌🏼

[05/08/21 12:11:30] **Pau Fitz:** Ya la compré ja

[05/08/21 12:11:36] **Pau Fitz:** En la Benavides

[05/08/21 12:11:47] **Pau Fitz:** Me regreso ?

[05/08/21 12:13:36] **Alfonso Alvarez:** Ve a cortarte el pelo o a comprarte ropa amor, o como tú quieras

[05/08/21 12:14:06] **Pau Fitz:** Bueno ahorita veo gracias amor

[05/08/21 12:39:39] **Pau Fitz:** Me avisas cualquier cosas estoy dando una vuelta y ahorita a la 1 regreso

[05/08/21 12:48:36] **Alfonso Alvarez:** Si amor, ya despertó cambie pañal y estoy preparado mamila

‎[06/08/21 16:17:40] **Alfonso Alvarez:** BBVA-6 ago 2021 161723.pdf • ‎7 pages ‎<attached: 00000150-BBVA-6 ago 2021 161723.pdf>

‎[06/08/21 16:21:14] **Pau Fitz:** doc06-08-2021_0_4.21.03.939 p.m..pdf • ‎1 page ‎<attached: 00000151-doc06-08-2021_0_4.21.03.939 p.m..pdf>

[06/08/21 16:26:29] **Alfonso Alvarez:** gracias mi amor 😘

[11/08/21 21:58:31] **Pau Fitz:** Mi amor el columpio de la bebé se quedó en el cuarto, en el mismo lugar donde estaba ya no lo pude sacar, solo para que no te vayas a tropezar te amo

[12/08/21 17:20:03] **Pau Fitz:** Amor

[12/08/21 17:20:10] **Alfonso Alvarez:** Diga

[12/08/21 17:20:14] **Pau Fitz:** Estás ocupado?

[12/08/21 17:20:20] **Alfonso Alvarez:** Subo

[12/08/21 17:20:29] **Pau Fitz:** 😘

‎[14/08/21 9:24:16] **Alfonso Alvarez:** ‎<attached: 00000168-PHOTO-2021-08-14-09-24-16.jpg>

[14/08/21 21:19:15] **Pau Fitz:** Amor puedes prender el monitor plis

[14/08/21 21:20:47] **Pau Fitz:** Olvídalo se despertó

[14/08/21 21:31:42] **Alfonso Alvarez:** 🙈

[17/08/21 16:26:24] **Alfonso Alvarez:** Amor a ver si encuentras en la zona de bebés el brochesito para el chupon 😘

[17/08/21 16:32:59] **Pau Fitz:** Ok amor

[18/08/21 21:34:22] **Pau Fitz:** Mi amor hice quesadillas están en el comal para que cenes con salsa te amo gracias por ayudarme y consentirme

[18/08/21 22:24:38] **Alfonso Alvarez:** Te amo tanto 🥰🥰🥰🥰😘

[19/08/21 20:35:18] **Pau Fitz:** Amor puedes prender el monitor porfa

[19/08/21 20:36:15] **Alfonso Alvarez:** 😘

[20/08/21 21:36:53] **Pau Fitz:** Mi amor hay sincronizadas en la estufa te amo 💕

[20/08/21 21:42:35] **Alfonso Alvarez:** Gracias mi amor t amo tanto 😘

[21/08/21 5:09:16] **Pau Fitz:** *No pude dormir nada después de tu berrinche de la madrugada, me quieres ayudar en algo? Consíguete algo para dormir toda la noche y ser una piedra que no se ande quejando, aparte de que me despierto, doy de comer la cambio la arrullo, tengo que pensar también en no hacer ruido para no despertarte. Porfa déjame sola aquí encerrada hoy gracias*

[22/08/21 21:38:24] **Pau Fitz:** Amor alrato que subas me podrías pasar el termo con agua, lo puedes dejar alado del lavabo plis te amo gracias ☺️

‎[23/08/21 12:12:29] **Alfonso Alvarez:** ‎<attached: 00000183-PHOTO-2021-08-23-12-12-29.jpg>

‎[23/08/21 12:12:29] **Alfonso Alvarez:** ‎<attached: 00000184-PHOTO-2021-08-23-12-12-29.jpg>

‎[23/08/21 12:12:29] **Alfonso Alvarez:** ‎<attached: 00000185-PHOTO-2021-08-23-12-12-29.jpg>

[24/08/21 8:43:55] **Pau Fitz:** *No te estoy dejando ni nada, solo por el bien de todos y que llegue en algún momento a existir un nosotros como familia vamos a irnos unos días, no te estoy culpando de nada solo lo necesitamos los 3*

[24/08/21 8:46:42] **Pau Fitz:** *No me estoy robando nada ni haciendo nada malo ni tonto, simplemente tuve que valorar la situación actual contra esto que está pasando con la bebé*

[24/08/21 9:33:22] **Alfonso Alvarez:** *Estoy en clase esperame*

[24/08/21 9:37:07] **Alfonso Alvarez:** *No tienes xq irte y no tienes xq decirme q me largue en la noche*

[24/08/21 11:16:13] **Pau Fitz:** *Me avisas cuando ya porfa, vamos a andar afuera mientras*

[24/08/21 11:50:48] **Alfonso Alvarez:** *No quiero q y vayas, no quiero q se vayan, somos una familia y deberíamos resolver nuestros problemas 
No t pido q me entiendas porque muchas veces ni yo lo hago, pero trato de hacer lo mejor q puedo y me lastima muchísimo q me hables feo y reacciono mal cuando lo haces
Perdóname por jalar a nuestra hija de una forma inapropiada, no hay justificación para eso 
Estoy triste por que extraño nuestra vida y me duele no poder hacer nada para ayudar a q esto mejore 
Me siento inseguro con las clases y trato de prepararme pero me cuesta mucho concentrarme y lo estoy haciendo súper mal y tampoco quiero dejarlo xq siempre dejo todo pero la mezcla trabajo y casa no me está saliendo bien y prefiero estar bien aquí, con ustedes 
Discúlpame de verdad pero no se cómo hacer para q no me afecte todo lo q ha cambiado en nuestra vida y q me trates así cuando sábado y domingo lo di todo y solo quería estar bien para mis clases pero termine haciendo el ridiculo otra vez y ya no se q hacer con nada o con todo*

[24/08/21 21:03:09] **Pau Fitz:** Amor

[24/08/21 21:03:33] **Pau Fitz:** Solo se ha tomado 1 y ya se durmió que hacemos

[25/08/21 11:29:29] **Alfonso Alvarez:** Compras fruta para ti y cuando salgas avísame, vamos a salir y traigo la llave

[26/08/21 10:36:09] **Pau Fitz:** El problema no es que duerma siestas cortas, si ni que no despierte de buenas. Hay que asegurarse que no ses hambre, que su pancita esté suave y que el entorno sea tranquilo (antes y durante el tiempo de sueño)

[26/08/21 10:36:31] **Pau Fitz:** Lo que me acaba de contestar la pediatra

[26/08/21 10:36:44] **Pau Fitz:** 🙄😡

‎[27/08/21 13:07:42] **Pau Fitz:** ‎<attached: 00000198-PHOTO-2021-08-27-13-07-42.jpg>

[27/08/21 13:09:17] **Pau Fitz:** Está en cargo auto

[27/08/21 13:28:15] **Alfonso Alvarez:** Ah ok

‎[27/08/21 17:10:45] **Pau Fitz:** ‎<attached: 00000201-PHOTO-2021-08-27-17-10-45.jpg>

[27/08/21 20:07:20] **Pau Fitz:** Amor no se te olvide la fórmula plis 😘, tal vez cuando llegues ya esté dormida

[30/08/21 15:58:05] **Pau Fitz:** Domperidona tabs

[30/08/21 15:58:21] **Pau Fitz:** Seronex

[01/09/21 21:49:56] **Pau Fitz:** Quesadillas en el comal 😘 te amo

[02/09/21 19:19:26] **Pau Fitz:** Amor cómo se llama Hans ?

[02/09/21 19:19:48] **Alfonso Alvarez:** Johan Karl Zimmermann

[02/09/21 19:19:58] **Pau Fitz:** Gracias ☺️

‎[02/09/21 19:24:46] **Pau Fitz:** ‎<attached: 00000209-PHOTO-2021-09-02-19-24-46.jpg>

[02/09/21 20:00:17] **Pau Fitz:** Amor me ayudas

[02/09/21 20:00:28] **Pau Fitz:** Puedes pasarme la taza

[02/09/21 20:00:30] **Pau Fitz:** Porfi

[03/09/21 13:30:16] **Pau Fitz:** 🤤https://youtu.be/N3TU35PnnI8

[03/09/21 13:51:41] **Pau Fitz:** Amor

[03/09/21 13:51:48] **Alfonso Alvarez:** Si

[03/09/21 13:51:52] **Pau Fitz:** Me ayuda

[03/09/21 16:26:48] **Pau Fitz:** Amor ya casi sin las 5 en 35

[03/09/21 19:08:51] **Pau Fitz:** Amor podrías pasar por una fórmula plis, no estoy segura si alcanza

[03/09/21 20:36:36] **Pau Fitz:** Acabo de bajar, aquí está tu cartera 🙄

‎[03/09/21 21:47:47] **Pau Fitz:** ‎<attached: 00000220-PHOTO-2021-09-03-21-47-47.jpg>

[03/09/21 21:51:18] **Alfonso Alvarez:** 🥰

[03/09/21 21:51:32] **Alfonso Alvarez:** Se la mandaste a mi mamá?

[04/09/21 16:37:40] **Pau Fitz:** Me podrías ayudar

[04/09/21 16:38:17] **Pau Fitz:** Poniendo una pijama la de flores y la de monos de nieve en el sol

[04/09/21 16:38:24] **Pau Fitz:** Porfa

[04/09/21 16:38:42] **Alfonso Alvarez:** Voy

[04/09/21 16:38:54] **Pau Fitz:** Gracias

‎[04/09/21 18:50:40] **Pau Fitz:** ‎<attached: 00000228-VIDEO-2021-09-04-18-50-40.mp4>

‎[04/09/21 18:50:40] **Pau Fitz:** ‎<attached: 00000229-PHOTO-2021-09-04-18-50-40.jpg>

‎[04/09/21 18:50:40] **Pau Fitz:** ‎<attached: 00000230-PHOTO-2021-09-04-18-50-40.jpg>

‎[04/09/21 18:50:46] **Pau Fitz:** ‎<attached: 00000231-VIDEO-2021-09-04-18-50-46.mp4>

[04/09/21 20:18:38] **Pau Fitz:** Amor

[04/09/21 20:19:10] **Pau Fitz:** Puedes servir en las mamilas 1 oz de agua

[04/09/21 20:19:30] **Pau Fitz:** Para que se vaya enfriando plis

[06/09/21 9:42:33] **Alfonso Alvarez:** Hola Alejandro buen día,
Espero te encuentres muy bien. El motivo de mi correo es relacionado con lo que platicamos el viernes. Creo que la universidad a veces le da mensajes encontrados a los alumnos con temas como la votación y hasta el hecho de mandar a los maestros de más de 60 a dar clases virtuales, pero los que no estamos vacunados seguimos exponiendo a nuestras familias. En mi caso particular, como sabes mi esposa se pudo poner una dosis antes de que naciera nuestra hija, pero ahora que hemos tenido que cambiar a fórmula incluso si ella se pone la segunda dosis, los anticuerpos ya no pasarían a la bebe y seguiría en riesgo, pues como sabes los vacunados podemos transmitir el virus (esto asumiendo que los dos nos pudiéramos vacunar próximamente).
Relacionado con lo anterior y los temas pendientes administrativos que tengo, me cuesta mucho trabajo cumplir con los mismos pues en casa seguimos viviendo una situación difícil con la bebe, el fin de semana no dejo de llorar y hoy la llevaremos nuevamente al doctor para realizar más estudios y pruebas.
Me da mucha pena tener que tomar esta decisión, como sabes en un principio estaba muy entusiasmado por iniciar esta nueva etapa pero me cuesta mucho mantener el balance mental que requiere dar clases y presentarme ante los estudiantes con la imagen, conocimientos y concentración que ello requiere.
Me duele porque estaba generando buena dinámica con los grupos y estábamos avanzando bien abriendo empresas y cuentas de operación en mercados de derivados. 
Yo estoy dispuesto a continuar con las clases que sean necesarias, pero te pido buscar un sustituto para mis grupos por todo lo antes mencionado.
Me da pena contigo y con los estudiantes, pero creo que es lo mejor para todos.
Quedo al pendiente.
Sent from my iPhone

‎[06/09/21 17:27:20] **Pau Fitz:** ‎<attached: 00000238-PHOTO-2021-09-06-17-27-20.jpg>

[06/09/21 21:55:42] **Pau Fitz:** Mi amor te hice dos quecas de harina pero creo que fue poquito perdón te amo

[06/09/21 21:56:01] **Alfonso Alvarez:** Gracias mi amor t amo

[06/09/21 21:56:03] **Alfonso Alvarez:** 😘

[06/09/21 21:56:35] **Pau Fitz:** 😘😘

[09/09/21 12:49:55] **Pau Fitz:** Mi amor que si queremos tacos

[09/09/21 12:49:59] **Pau Fitz:** Hans quiere

[09/09/21 20:25:18] **Pau Fitz:** *Libro pregos 
Amo incondicionalmente a mi hija no existe duda alguna, estas palabras no deben interpretarse como falta de amor, cariño o devoción total a la expresión de familia; mi familia.
No creo que exista edad, madurez o momento adecuado que en su totalidad asegure que ser mamá es una tarea sencilla. 
Ser mujer en este plano de existencia es complejo, ser mamá y ser una mamá consciente es casi doloroso. 
Estaba en una punto  de quiebre en donde la soledad dominaba mis días cuando decidí escribir un diario sobre mi cuarentena, tiempo después me animé a leerlo; me bastó con leer el día 3 para sentirme preocupada por la salud mental de la persona que había escrito esas palabras.*

[09/09/21 20:25:36] **Pau Fitz:** Muy dark?

[10/09/21 19:38:31] **Pau Fitz:** Amor vamos a necesitar otra fórmula pero dejaste de nuevo tu cartera 😓

[10/09/21 20:18:53] **Alfonso Alvarez:** 🙈

[10/09/21 20:18:59] **Alfonso Alvarez:** No importa amor 😘

[10/09/21 20:19:12] **Pau Fitz:** Ya seee perdón mi amor

[10/09/21 20:19:30] **Pau Fitz:** No se ha despertado desde la tarde 🙄

[10/09/21 20:19:46] **Alfonso Alvarez:** 😁

[13/09/21 12:18:20] **Pau Fitz:** Se me olvidó la lista a ver si tienes chance amor 🥰

[13/09/21 12:18:25] **Pau Fitz:** De mandármela

‎[13/09/21 12:32:04] **Alfonso Alvarez:** ‎<attached: 00000255-PHOTO-2021-09-13-12-32-03.jpg>

[13/09/21 12:32:25] **Pau Fitz:** 😘😘 gracias 🤩

[14/09/21 12:34:05] **Alfonso Alvarez:** Hol

‎[14/09/21 19:37:47] **Pau Fitz:** ‎<attached: 00000258-PHOTO-2021-09-14-19-37-47.jpg>

[14/09/21 19:38:18] **Alfonso Alvarez:** 😘

[15/09/21 14:13:11] **Pau Fitz:** Mi amor donde estás

‎[16/09/21 8:32:24] **Pau Fitz:** ‎<attached: 00000261-PHOTO-2021-09-16-08-32-24.jpg>

[16/09/21 8:32:40] **Pau Fitz:** Me da pena escribirle a tu mamá tu mándasela

[16/09/21 22:27:31] **Alfonso Alvarez:** https://youtu.be/26IrQK4ayDo

‎[17/09/21 6:42:00] **Pau Fitz:** AAMA841018HMSLRL06.pdf • ‎1 page ‎<attached: 00000264-AAMA841018HMSLRL06.pdf>

‎[17/09/21 11:48:40] **Pau Fitz:** ‎image omitted

[19/09/21 11:29:37] **Alfonso Alvarez:** https://youtu.be/5HMmu9Lksfc

‎[19/09/21 16:10:30] **Pau Fitz:** ‎<attached: 00000267-PHOTO-2021-09-19-16-10-30.jpg>

‎[19/09/21 17:35:30] **Pau Fitz:** ‎<attached: 00000268-VIDEO-2021-09-19-17-35-30.mp4>

[20/09/21 14:36:17] **Alfonso Alvarez:** *Q esta pasando?? D verdad tanto pancho por un ladrido ?*

[20/09/21 14:36:48] **Alfonso Alvarez:** *Y como si yo tuviera la culpa*

[20/09/21 20:18:19] **Pau Fitz:** Amor no se te olvide la fórmula gracias te amo

‎[21/09/21 18:14:21] **Pau Fitz:** ‎<attached: 00000272-PHOTO-2021-09-21-18-14-21.jpg>

‎[21/09/21 18:14:21] **Pau Fitz:** ‎<attached: 00000273-PHOTO-2021-09-21-18-14-21.jpg>

[22/09/21 9:58:00] **Pau Fitz:** https://www.gandhi.com.mx/el-hierofante

[22/09/21 15:18:44] **Pau Fitz:** https://www.amazon.com.mx/Tommee-Tippee-Closer-to-Nature/dp/B017K3YKDW/ref=asc_df_B07856V1CS/?tag=glemobshopmx-20&linkCode=df0&hvadid=295446162868&hvpos=&hvnetw=g&hvrand=5743161272290988858&hvpone=&hvptwo=&hvqmt=&hvdev=m&hvdvcmdl=&hvlocint=&hvlocphy=20716&hvtargid=pla-522499514562&psc=1&th=1

[22/09/21 16:43:05] **Alfonso Alvarez:** https://covid19.sanantonio.gov/What-YOU-Can-Do/Vaccination?lang_update=637674686865963561
In Spanish....
Mehr information wird folgen. Bin am J&J suchen

[22/09/21 16:43:05] **Alfonso Alvarez:** https://www.cdc.gov/coronavirus/2019-ncov/vaccines/safety/JJUpdate.html

[22/09/21 16:43:05] **Alfonso Alvarez:** https://espanol.cdc.gov/coronavirus/2019-ncov/vaccines/safety/JJUpdate.html

[22/09/21 16:43:05] **Alfonso Alvarez:** https://ots.nbcwpshield.com/news/national-international/fda-to-add-new-warning-of-rare-nerve-disorder-to-jj-covid-19-vaccine/6268062/
Ist ein Grund dass viele provedoores Moderna und Pfizer beforzugen. 
Johnson's wirksamkeit ist auch tiefer und ein Booster nach 6 Monaten ist empfohlen. 
Ein Tennis Kolleg hat den Johnson vaccine erhalten. Es hat Ihn schwer mitgenommen fuer ein Monat und er musste ins Spital. 
Ich wuerde also dass Moderna/Pfizer vorziehen.

[22/09/21 16:43:05] **Alfonso Alvarez:** https://espanol.cdc.gov/coronavirus/2019-ncov/vaccines/safety/JJUpdate.html

[22/09/21 16:43:05] **Alfonso Alvarez:** https://www.sanantonio.gov/gpa/News/ArtMID/24373/ArticleID/21237/San-Antonio-International-Airport-Continues-to-Offer-Free-COVID-19-Vaccines
Habe Airport angerufen. Die Covid Impfstation bleibt offen an alle bis December. 
Baggage Area Terminal A.

[23/09/21 8:41:09] **Pau Fitz:** 12:30 Cita con el pediatra

[23/09/21 14:34:51] **Pau Fitz:** Mucovibrol gotas pediatrico

[24/09/21 18:41:00] **Pau Fitz:** *Te prometo que en el momento que pueda despegarme más de la bebé te dejamos en paz, tú querías esto tú me buscaste a mi, si soy yo lo peor que te ha pasado porque está situación es gracias a mi, de cualquier modo no vamos a soportar estar aquí en la casa todo el día juntos, no nos soportas y yo no aguanto que me restriegues el súper hombre que eres y al parecer lo malagradecida que soy por no tragarme mis palabras u quedarme callada porque tú haces todo y solo debería de estar fascinada y contenta, no eres el hombre más sencillo del mundo no es fácil ser tú esposa ni nada*

[24/09/21 18:42:06] **Alfonso Alvarez:** *No se q t pasa! Trato de dar lo mejor hasta postre quise hacer y se me cayó algo*

[24/09/21 18:44:28] **Alfonso Alvarez:** *Tu no puedes hacer cosas d la casa xq t estás recuperando y si soy un súper hombre q hace todo y mas d lo q cualquiera pero nunca digo q seas malagradecida nada más q entiendas q no puedo hacer todo y estar al cien para ti y aun así lo hago y t apoyo pero no es mi culpa nada d lo q pasa ni tuya*

[24/09/21 18:45:59] **Alfonso Alvarez:** *No es fácil ser tu esposa o esposo de nadie y menos cuando estamos todo el día encerrados sea cual sea el motivo pero deja de echarme la culpa q ya me canse d ser el negativo y el culpable de todo lo malo cuando hago lo mejor q puedo y hasta donde puedo*

[24/09/21 18:49:01] **Alfonso Alvarez:** *Es normal q t sientas mal por todo lo q ha pasado y lo entiendo y t apoyo pero no es mi culpa ni de nadie*

[24/09/21 18:55:04] **Alfonso Alvarez:** *La enfermedad de la bebe nos espantó y todavía no se acaba y se q es difícil xq tu la cuidas y es lo q nos toca, yo hago la casa y tú la bebe, pero va a pasar y ya*

[24/09/21 18:55:43] **Alfonso Alvarez:** *Perdón x el ruido créeme q no lo hice q propósito pero es un ruido accidental y ya*

[25/09/21 10:21:10] **Pau Fitz:** https://www.caligramaeditorial.com/entrevista-a-leeloo-dallas/

[25/09/21 10:22:28] **Pau Fitz:** https://www.delectoralector.com/el-hierofante/

[26/09/21 20:03:57] **Pau Fitz:** Amor

[26/09/21 20:04:05] **Alfonso Alvarez:** Si

[26/09/21 20:04:15] **Pau Fitz:** Me ayudarías a prender el ventilador plis

[26/09/21 20:04:54] **Pau Fitz:** Gracias 😘

[26/09/21 20:05:38] **Alfonso Alvarez:** 😘

[27/09/21 19:22:14] **Pau Fitz:** https://youtu.be/aMS07IiiNWE

[27/09/21 20:13:32] **Alfonso Alvarez:** 18 a 29 😥

[27/09/21 20:43:34] **Pau Fitz:** Mañana marcó a ver qué dicen, te hice unas quesadillas te amo

[27/09/21 21:52:00] **Alfonso Alvarez:** Te amo 😘

‎[28/09/21 22:07:27] **Alfonso Alvarez:** ‎<attached: 00000302-PHOTO-2021-09-28-22-07-27.jpg>

[29/09/21 14:54:57] **Pau Fitz:** *La que se tuvo que haber largado a comer soy yo, ya estoy hasta la madre de tener que despertar así con tu Jeta y hasta la de tu perra nada más porque no les gusta despertar temprano, no es mi pedo ni de la niña, te sientes mucho por haber dicho te ayudo después de que ya colapse crees que eres mi salvador o que, no haz tocado a la niña ni un minutos en días pero prefieres hacer cosas extras y de más para no tener que hacer nada con o por ella neta no te voy la voy a perdonar que tú hayas ido a comer algo y yo esté aquí en chunga dando Bibi mientras trago un pinche sándwich y por favor cuando llegues ni me voltees a ver ni me hables*

[29/09/21 14:59:39] **Pau Fitz:** *Y ni se te ocurra querer llegar a jalonearme a mi o a la niña*

[29/09/21 15:00:03] **Pau Fitz:** *Pd. Leeloo sillón o cama ya estoy hasta la madre de estar entre pelos todo el tiempo*

[29/09/21 15:04:23] **Alfonso Alvarez:** 🤨

[29/09/21 15:05:39] **Alfonso Alvarez:** *Órale q padre saber lo q piensas, no t preocupes justo estoy pensando en una solución xq ya veo q aun cuando me voy a salir d trabajar y necesito 2. Días para cumplir, nada es suficiente*

[29/09/21 17:43:35] **Pau Fitz:** *Ya no quiero esto, ya no quiero nada, no sirve de nada estar aquí ya no puedo*

[29/09/21 17:45:58] **Alfonso Alvarez:** *Estoy en junta y se ven tus mensajes xq estoy enseñando mi teléfono*

[30/09/21 7:44:09] **Pau Fitz:** *No tienes que salir ?*

‎[01/10/21 14:04:43] **Pau Fitz:** ‎<attached: 00000311-PHOTO-2021-10-01-14-04-43.jpg>

‎[01/10/21 14:04:44] **Pau Fitz:** ‎<attached: 00000312-PHOTO-2021-10-01-14-04-44.jpg>

‎[01/10/21 15:46:06] **Alfonso Alvarez:** ‎<attached: 00000313-PHOTO-2021-10-01-15-46-06.jpg>

[01/10/21 15:46:26] **Pau Fitz:** jajaja chamaca

[01/10/21 16:34:58] **Alfonso Alvarez:** Q haces?

[01/10/21 16:35:03] **Alfonso Alvarez:** Quieres venir?

[01/10/21 19:02:44] **Pau Fitz:** https://youtu.be/5tKCxdySAtc

‎[02/10/21 11:14:42] **Alfonso Alvarez:** ‎<attached: 00000318-PHOTO-2021-10-02-11-14-42.jpg>

[02/10/21 12:00:17] **Pau Fitz:** https://youtu.be/eTxZiCu0_P0

[02/10/21 15:31:10] **Pau Fitz:** Mi amor pago yo el filtro? $5,171

[02/10/21 15:32:28] **Alfonso Alvarez:** Sip ya t deposite lo q tenía ahora y luego t mando más

[02/10/21 15:32:42] **Pau Fitz:** Ok 😘😘

[03/10/21 21:01:34] **Pau Fitz:** Se despertó y está comiendo más

‎[04/10/21 18:54:13] **Pau Fitz:** ‎<attached: 00000324-PHOTO-2021-10-04-18-54-13.jpg>

[04/10/21 18:54:51] **Pau Fitz:** Estás son las próximas citas disponibles para la visa 🥴

[04/10/21 18:56:48] **Pau Fitz:** Me lo mando Maye

[04/10/21 18:57:00] **Alfonso Alvarez:** Le dijiste?

[04/10/21 19:17:02] **Pau Fitz:** Le pregunté de su gestor

‎[07/10/21 13:52:04] **Alfonso Alvarez:** ‎<attached: 00000329-PHOTO-2021-10-07-13-52-04.jpg>

[07/10/21 13:53:19] **Pau Fitz:** 👏🏽👏🏽👏🏽😘 te amo, ya casi voy, falta algo ?

[07/10/21 13:55:51] **Alfonso Alvarez:** No amor, tu tranquila 😘

[07/10/21 13:56:22] **Alfonso Alvarez:** Estuvo súper y le metí la chichitq yle dio un trago y se cuajó

[07/10/21 13:56:59] **Pau Fitz:** Me imaginé jaja

[07/10/21 14:32:46] **Alfonso Alvarez:** https://youtu.be/8Ccpobip-Fs

[09/10/21 11:51:08] **Pau Fitz:** Amor

[09/10/21 11:51:35] **Pau Fitz:** Puedes venir a apagar el calentador plis

[12/10/21 19:03:17] **Pau Fitz:** Amor

[12/10/21 19:03:23] **Pau Fitz:** Me ayudas plis

[12/10/21 19:04:22] **Pau Fitz:** Podrías hacer 3 oz de leche porfa y ayudarme a enfriarlas

[12/10/21 19:17:32] **Pau Fitz:** ‎This message was deleted.

[13/10/21 12:59:01] **Pau Fitz:** Amor

[13/10/21 12:59:16] **Alfonso Alvarez:** Diga

[13/10/21 12:59:17] **Pau Fitz:** Me ayudas

[13/10/21 12:59:24] **Alfonso Alvarez:** Voy

[13/10/21 12:59:27] **Pau Fitz:** A hacer otras 4 plis

[13/10/21 12:59:31] **Pau Fitz:** Oz

[13/10/21 12:59:47] **Pau Fitz:** Se está durmiendo de nuevo

[13/10/21 12:59:59] **Alfonso Alvarez:** Caliento agua bdd?

[13/10/21 13:00:04] **Alfonso Alvarez:** Vdd *

[13/10/21 13:00:14] **Pau Fitz:** Ya no hay en el termo ?

[13/10/21 13:01:01] **Alfonso Alvarez:** Llevábamos 6 xq las conté Antes d irnos

[13/10/21 13:01:08] **Alfonso Alvarez:** Y le hice 5 allá

[13/10/21 13:01:28] **Pau Fitz:** Ok aquí arriba hay mamilas que tienen agua fría

[13/10/21 13:01:39] **Alfonso Alvarez:** Ya puse el agua y voy a meter una taza al conge

[13/10/21 13:01:50] **Alfonso Alvarez:** Ah ok 👌🏼

[13/10/21 13:02:01] **Pau Fitz:** Gracias te amo 💕

[13/10/21 13:02:11] **Alfonso Alvarez:** 😘

‎[13/10/21 13:10:35] **Pau Fitz:** ‎<attached: 00000358-PHOTO-2021-10-13-13-10-35.jpg>

[13/10/21 13:10:57] **Pau Fitz:** Me lo mando mi bro

‎[13/10/21 13:43:47] **Pau Fitz:** ‎<attached: 00000360-PHOTO-2021-10-13-13-43-47.jpg>

[13/10/21 17:27:29] **Alfonso Alvarez:** *Donde estás?*

[13/10/21 19:12:48] **Alfonso Alvarez:** *Oye q t pasa??*

[13/10/21 19:12:50] **Alfonso Alvarez:** *Ábreme*

[13/10/21 19:14:32] **Alfonso Alvarez:** *Xq t pones así?? Gritando como en vecindad y aventando cosas q onda??*

[13/10/21 19:14:50] **Alfonso Alvarez:** *Ábreme !!*

[13/10/21 19:15:11] **Alfonso Alvarez:** *ÁBREME!!*

[13/10/21 19:18:19] **Alfonso Alvarez:** *Tu estás haciendo todo esto en un arranque y mientras más lejos lo lleves más lejos va a llegar esto*

[13/10/21 19:18:26] **Alfonso Alvarez:** *Ábreme!*

[13/10/21 19:19:08] **Alfonso Alvarez:** *Ya llegaste a los gritos y aventar cosas*

[13/10/21 19:19:25] **Alfonso Alvarez:** *Ábreme!!!*

[13/10/21 19:20:07] **Alfonso Alvarez:** *Si me dejas aquí 5 min mas no quiero saber nada más d ti, ABRE!!!*

[13/10/21 19:21:57] **Pau Fitz:** *A ver qué se siente*

[13/10/21 19:22:09] **Pau Fitz:** *Hasta que se duerma*

[13/10/21 19:22:13] **Pau Fitz:** *Igual que me hiciste*

[13/10/21 19:22:15] **Alfonso Alvarez:** *Yo no t deje afuera ni hice un show*

[13/10/21 19:22:26] **Pau Fitz:** *Si lo hiciste las dos cosas*

[13/10/21 19:22:34] **Alfonso Alvarez:** *Q????*

[13/10/21 19:22:53] **Alfonso Alvarez:** *Nadie me escucho gritándote ni t aventé nada*

[13/10/21 19:23:05] **Alfonso Alvarez:** *Y t deje en la casa*

[13/10/21 19:23:24] **Alfonso Alvarez:** *Tengo cosas q hacer ábreme!!*

[13/10/21 19:23:38] **Pau Fitz:** *Estás en la casa*

[13/10/21 19:23:48] **Pau Fitz:** *Ahí tienes con que entretenerte*

[13/10/21 19:25:30] **Alfonso Alvarez:** *Q t pasa??*

[13/10/21 19:26:04] **Pau Fitz:** *No es así ? Cómo no m querías ver me dejaste afuera/

[13/10/21 19:26:08] **Pau Fitz:** *Iguales*

[13/10/21 19:26:30] **Pau Fitz:** *Hasta q se duerma*

[13/10/21 19:26:31] **Alfonso Alvarez:** *No dije eso, dije q no me gusta q este cuando la cuido*

[13/10/21 19:27:10] **Alfonso Alvarez:** *??? De esto se trata?? Tu me haces y yo t hago?*

[13/10/21 19:27:49] **Pau Fitz:** *Si haces ese tipo de jaladas, si*

[13/10/21 19:28:15] **Alfonso Alvarez:** *Q jalada?? Tratar de enseñarle q no pasa nada ?!*

[13/10/21 19:32:39] **Pau Fitz:** *Ay poncho ahora resulta*

[13/10/21 19:35:07] **Pau Fitz:** *Q te crees que puedes hacer y hacerme lo que quieras, no te metas conmigo, ni le digas a mi hija que yo no la sé cuidar y que la hago llorar*

[13/10/21 19:35:27] **Pau Fitz:** *Hago todoooo lo que tú no quieres hacer*

[13/10/21 19:36:38] **Pau Fitz:** *Para q después de que 5 veces las haz cuidado y desde hace 15 días te cae bien y ahora ya quieres venir a enseñarme cómo si hubieras estado tan presente*

[13/10/21 19:36:42] **Pau Fitz:** *Estás mal*

[14/10/21 14:25:57] **Pau Fitz:** *Amor todo bien ?*

[15/10/21 21:19:05] **Pau Fitz:** Mi amor no metí a la perrita porque te va a hacer fiestas ahorita que entres y seguro vas a salir al patio tantito 😔perdón

[15/10/21 21:25:18] **Alfonso Alvarez:** No t preocupes amor yo la meto 😘

[16/10/21 11:35:15] **Alfonso Alvarez:** Donde están?

[17/10/21 22:02:11] **Pau Fitz:** Mi amor apagamos el calentador para dormir ?

[17/10/21 22:02:31] **Pau Fitz:** Si si me ayudas a apagarlo antes de subir plis te amo

‎[19/10/21 11:02:48] **Alfonso Alvarez:** ‎<attached: 00000403-VIDEO-2021-10-19-11-02-48.mp4>

[19/10/21 11:24:37] **Pau Fitz:** Mi bebé 👶🏽😘

[19/10/21 11:24:39] **Pau Fitz:** Los amo

[19/10/21 11:25:01] **Pau Fitz:** Ya voy de regreso, voy a pasar a la farmacia y gasolina

[19/10/21 11:31:54] **Alfonso Alvarez:** Ok

[19/10/21 12:01:40] **Pau Fitz:** Mi amor si hay dinero en tu tarjeta como para llenar el tanque ?

[19/10/21 12:08:04] **Alfonso Alvarez:** 1,154 menos lo q hayas gastado pero déjame sacar

[19/10/21 12:08:43] **Alfonso Alvarez:** Ya saque

[19/10/21 12:08:48] **Alfonso Alvarez:** 😘

[19/10/21 12:08:49] **Pau Fitz:** Ok me espero porque compre leche y medicinas

[19/10/21 12:08:54] **Pau Fitz:** Gracias amor te amo

[19/10/21 12:08:57] **Alfonso Alvarez:** Ya está el dinero

[19/10/21 12:09:24] **Pau Fitz:** Ok 👍🏽

‎[19/10/21 13:17:48] **Pau Fitz:** ‎image omitted

‎[20/10/21 14:48:13] **Pau Fitz:** ‎<attached: 00000417-PHOTO-2021-10-20-14-48-13.jpg>

[21/10/21 8:43:16] **Alfonso Alvarez:** https://youtu.be/Fpc_jJQ_8WE

[22/10/21 21:18:46] **Pau Fitz:** Mi amor podrías apagar el calentador plis

[22/10/21 22:00:18] **Alfonso Alvarez:** Amor me quede afuera encerrado, me abres 🙈

[22/10/21 22:49:15] **Alfonso Alvarez:** Amor me ayudas xfis

[24/10/21 10:01:01] **Pau Fitz:** Está dormida, me voy a bañar

[24/10/21 10:01:38] **Alfonso Alvarez:** Ok 😘

[24/10/21 19:09:28] **Pau Fitz:** Ya no 😘

‎[26/10/21 9:37:50] **Pau Fitz:** ‎<attached: 00000425-PHOTO-2021-10-26-09-37-50.jpg>

‎[26/10/21 9:37:51] **Pau Fitz:** ‎<attached: 00000426-PHOTO-2021-10-26-09-37-51.jpg>

[27/10/21 14:50:43] **Pau Fitz:** *Si quieres ir a Costco, mañana comemos eso y tú come en la calle mc donalds o lo que quieres, no tengo ganas ni de comer ni de hablar ni de nada perdón*

[28/10/21 9:28:52] **Pau Fitz:** *A las 11 quería salir espero no haya problema y que pueda usar tu carro*

[28/10/21 12:30:35] **Alfonso Alvarez:** Es tuyo 😘

‎[28/10/21 16:44:28] **Pau Fitz:** ‎<attached: 00000430-VIDEO-2021-10-28-16-44-28.mp4>

[30/10/21 8:01:04] **Alfonso Alvarez:** Esta dormida 😘

[30/10/21 8:02:36] **Pau Fitz:** Súper ! Ya estoy adentro de la como cancha y estoy sentada

[30/10/21 8:02:43] **Pau Fitz:** No creo que he tarde tanto

[30/10/21 8:03:01] **Alfonso Alvarez:** Super 👌🏼 en una hora máximo estás aquí 😘

[30/10/21 8:03:32] **Pau Fitz:** Sii, todavía no empiezan a vacunar, se ve que todavía no llegan las vacunas pero no creo tardar te amo

[30/10/21 9:14:38] **Alfonso Alvarez:** Como vas?

[30/10/21 9:28:32] **Pau Fitz:** Ya sigo yo, ya estoy sentada para la vacuna

[30/10/21 9:28:38] **Pau Fitz:** Ustedes cómo van

[30/10/21 9:33:28] **Pau Fitz:** Amor

[30/10/21 9:33:43] **Pau Fitz:** Ya me dio nervio ya preguntaron mucho de si ya te habías puesto una antes

[30/10/21 9:33:49] **Pau Fitz:** Y que el sistema se va a dar cuenta

[30/10/21 9:33:51] **Pau Fitz:** Que hago

[30/10/21 9:38:31] **Pau Fitz:** Amoooor

[30/10/21 9:38:40] **Pau Fitz:** Si están pasando el código en una compu

[30/10/21 9:39:22] **Pau Fitz:** Ayyy contéstame

[30/10/21 9:39:37] **Pau Fitz:** Que hago ?!! No quiero hacer el oso

[30/10/21 9:39:40] **Pau Fitz:** Me salgo ?

[30/10/21 9:41:08] **Pau Fitz:** ‎Missed voice call

[30/10/21 9:53:23] **Pau Fitz:** Ya me la pusieron si me
Dicen algo lo voy a negar todo

[30/10/21 9:53:31] **Pau Fitz:** Que fui embarazada y no me la
Pusieron

[30/10/21 10:00:40] **Alfonso Alvarez:** Perdón amor estaba atendiendo crisis 😅

‎[30/10/21 11:00:08] **Alfonso Alvarez:** ‎<attached: 00000452-PHOTO-2021-10-30-11-00-07.jpg>

[30/10/21 21:30:33] **Pau Fitz:** https://www.amazon.com.mx/Cheelom-Higrómetro-temperatura-interruptor-invernadero/dp/B07WD9T585/ref=pd_aw_fbt_img_1/146-4419170-1076227?pd_rd_w=L4oTk&pf_rd_p=76d46083-cf0f-47f3-9fef-4f5ddac4094b&pf_rd_r=BVR14MEXZZM2XWHZFNQP&pd_rd_r=be721ecf-5c0f-4060-8062-7fbb16f72958&pd_rd_wg=fn5Mq&pd_rd_i=B07WD9T585&psc=1

[31/10/21 20:46:18] **Alfonso Alvarez:** https://youtu.be/e3k--NsfSL8

‎[01/11/21 8:24:32] **Pau Fitz:** ‎<attached: 00000455-PHOTO-2021-11-01-08-24-32.jpg>

[02/11/21 10:34:59] **Alfonso Alvarez:** https://youtu.be/389OXBmyO7Y

‎[02/11/21 17:41:31] **Pau Fitz:** ‎<attached: 00000457-PHOTO-2021-11-02-17-41-31.jpg>

‎[02/11/21 17:41:32] **Pau Fitz:** ‎<attached: 00000458-PHOTO-2021-11-02-17-41-32.jpg>

[02/11/21 21:20:37] **Pau Fitz:** Se despertó y está comiendo

[03/11/21 17:43:19] **Alfonso Alvarez:** https://youtu.be/V3QrG8iLDGQ

[04/11/21 11:23:49] **Pau Fitz:** Ya voy amor

[04/11/21 11:23:54] **Pau Fitz:** Todo bien ?

[04/11/21 14:58:30] **Pau Fitz:** https://www.amazon.com.mx/HOMEMAKE-FURNITUREEscritorio-computadora-escritorio-habitación/dp/B087B2N6CK/?_encoding=UTF8&pf_rd_p=7a1473a0-7228-4494-bdf5-96f089d3a04d&pd_rd_wg=akekm&pf_rd_r=8NARZCRQM3BJMG80NF30&pd_rd_w=z8Bff&pd_rd_r=fb5d63af-09d7-4de2-ac6b-3ae8176124c9&ref_=pd_gwm_ci_mcx_mr_hp_m

[04/11/21 15:06:08] **Pau Fitz:** https://www.amazon.com.mx/FurnitureR-anidación-industriales-Laterales-apilables/dp/B097XY7XLN/ref=mp_s_a_1_3?crid=1UZFJ2UXUG77T&keywords=mesas%2Blaterales&qid=1636059917&sprefix=mesas%2B&sr=8-3&th=1&psc=1

‎[04/11/21 16:23:02] **Pau Fitz:** ‎<attached: 00000465-PHOTO-2021-11-04-16-23-02.jpg>

[04/11/21 16:23:23] **Alfonso Alvarez:** 🥰

[04/11/21 17:28:13] **Pau Fitz:** No tarda en venir el plomero amor 🥰

‎[06/11/21 13:48:29] **Alfonso Alvarez:** ‎<attached: 00000468-PHOTO-2021-11-06-13-48-29.jpg>

‎[06/11/21 13:48:30] **Alfonso Alvarez:** ‎<attached: 00000469-PHOTO-2021-11-06-13-48-30.jpg>

‎[06/11/21 13:48:31] **Alfonso Alvarez:** ‎<attached: 00000470-PHOTO-2021-11-06-13-48-30.jpg>

‎[06/11/21 13:48:31] **Alfonso Alvarez:** ‎<attached: 00000471-PHOTO-2021-11-06-13-48-31.jpg>

‎[06/11/21 13:48:32] **Alfonso Alvarez:** ‎<attached: 00000472-VIDEO-2021-11-06-13-48-32.mp4>

‎[06/11/21 13:48:33] **Alfonso Alvarez:** ‎<attached: 00000473-PHOTO-2021-11-06-13-48-32.jpg>

‎[06/11/21 13:48:33] **Alfonso Alvarez:** ‎<attached: 00000474-PHOTO-2021-11-06-13-48-33.jpg>

‎[06/11/21 13:48:34] **Alfonso Alvarez:** ‎<attached: 00000475-VIDEO-2021-11-06-13-48-33.mp4>

[06/11/21 14:08:14] **Alfonso Alvarez:** https://youtu.be/iZlKx8CeeKc

[06/11/21 16:12:04] **Pau Fitz:** https://www.amazon.com.mx/ALVABABY-Printed-Reuseable-Washable-Nappies/dp/B01M153SEH/ref=mp_s_a_1_5?crid=1201KHN4JA2VA&keywords=alva+baby&qid=1636236624&refinements=p_85%3A9841545011&rnid=9754434011&rps=1&sprefix=alva+&sr=8-5

[06/11/21 16:15:02] **Pau Fitz:** https://www.amazon.com.mx/Pocket-Adjustable-Reusable-Inserts-Neutral/dp/B00IRP6B8A/ref=mp_s_a_1_3?crid=1201KHN4JA2VA&keywords=alva+baby&qid=1636236624&refinements=p_85%3A9841545011&rnid=9754434011&rps=1&sprefix=alva+&sr=8-3

[06/11/21 16:15:07] **Pau Fitz:** Este

[08/11/21 12:51:54] **Alfonso Alvarez:** Meditación 1 - 12 min 🥴

[08/11/21 12:52:18] **Alfonso Alvarez:** Ya estamos ajustando pero va a quedar como de 11….

[08/11/21 12:57:37] **Pau Fitz:** Mjule jajajja

‎[08/11/21 12:58:23] **Pau Fitz:** ‎<attached: 00000483-PHOTO-2021-11-08-12-58-23.jpg>

[08/11/21 13:56:28] **Alfonso Alvarez:** Ya casi acabamos

[09/11/21 13:00:36] **Pau Fitz:** Mi mamá sale 8:30 de cuerna

[09/11/21 13:00:51] **Pau Fitz:** Llega como 12:30-1

[10/11/21 10:43:43] **Pau Fitz:** Nos podemos quedar solo por hoy en tu casa? Mañana nos vamos con mi mamá para que me ayude con Gaia

[10/11/21 13:27:16] **Pau Fitz:** ‎This message was deleted.

[11/11/21 10:13:23] **Alfonso Alvarez:** Amor, me avisas como a q hora llega xfis o ya definitivamente a ls 12:30?

[11/11/21 10:22:05] **Pau Fitz:** Salió 8:30 su camión

[11/11/21 10:22:18] **Pau Fitz:** Y creo que se hace 5 horas

[11/11/21 10:22:23] **Pau Fitz:** 1:30 pero te confirmo

[11/11/21 10:22:29] **Pau Fitz:** Déjame le hablo

[11/11/21 10:26:31] **Pau Fitz:** Que hasta las 2:30 masomenos apenas se ata en tasqueña y dicen que de ahí son 4 horas para acá

[11/11/21 10:26:38] **Pau Fitz:** 😅 es un buen

[11/11/21 10:54:16] **Alfonso Alvarez:** Ok amor ntp

[11/11/21 10:54:49] **Alfonso Alvarez:** Si no me regreso y voy después, vamos viendo como avanzo yo también pero tranquila

[11/11/21 11:22:52] **Pau Fitz:** Sale te amo mi amor 🥰

[11/11/21 11:23:05] **Alfonso Alvarez:** Te amo 😘

[11/11/21 12:15:00] **Pau Fitz:** Lleva 2 hrs dormida 😬

[11/11/21 12:25:17] **Alfonso Alvarez:** Gaia o tu mamá?

[11/11/21 12:35:56] **Pau Fitz:** Jajajaja Gaia

[11/11/21 12:36:02] **Pau Fitz:** Bueno quien sabe si las dos

[11/11/21 12:36:11] **Pau Fitz:** Acaban de llegar los pañales 🎊

[11/11/21 12:36:32] **Alfonso Alvarez:** 👏🏼👏🏼👏🏼

[11/11/21 12:36:43] **Alfonso Alvarez:** Seguro tu mamá también

[11/11/21 12:36:48] **Pau Fitz:** Jajaj yo creo

[11/11/21 12:39:42] **Alfonso Alvarez:** Entonces tu mamá llega 2:30?

[11/11/21 12:39:49] **Alfonso Alvarez:** Ya acabé 🤓

[11/11/21 12:40:02] **Pau Fitz:** Sii todavía le falta

[11/11/21 12:40:09] **Pau Fitz:** Súper 👏🏽

[11/11/21 12:40:11] **Alfonso Alvarez:** Voy a costco?

[11/11/21 12:40:18] **Pau Fitz:** A pues si

[11/11/21 12:40:57] **Pau Fitz:** No anote un detergente para la ropa de Gaia

[11/11/21 12:41:38] **Pau Fitz:** Va a ser diferente el de los pañales, si vas cuando estés en esa zona me hablas para ver cuál?

[11/11/21 12:41:53] **Pau Fitz:** Oye y tú tía norma me ha marcado varías veces

[11/11/21 12:41:57] **Pau Fitz:** Que hago ?

[11/11/21 12:42:29] **Alfonso Alvarez:** Bloquéala en whatsapp y luego en el Tel

[11/11/21 12:42:37] **Pau Fitz:** Ok

[11/11/21 12:42:53] **Alfonso Alvarez:** Mándame la lista pls

[11/11/21 12:44:43] **Alfonso Alvarez:** https://youtu.be/9ApOi5ScHu0

[11/11/21 12:44:48] **Pau Fitz:** Eucerin 
Queso 
Stevia ( o azúcar baja en calorías) 
Detergente pañales 
Detergente ropa Gaia 
Jabón liquido manos 
No sé si leche

[11/11/21 12:45:04] **Alfonso Alvarez:** 👌🏼

[11/11/21 12:50:47] **Pau Fitz:** Órale está buena la idea

[11/11/21 12:53:49] **Pau Fitz:** Dice mi mamá que los pararon en un retén a revisar, andan buscando migrantes

‎[11/11/21 13:24:33] **Alfonso Alvarez:** ‎<attached: 00000526-PHOTO-2021-11-11-13-24-33.jpg>

[11/11/21 13:24:47] **Pau Fitz:** Ay que padres

‎[11/11/21 13:25:18] **Alfonso Alvarez:** ‎<attached: 00000528-AUDIO-2021-11-11-13-25-18.opus>

‎[11/11/21 13:25:40] **Alfonso Alvarez:** ‎<attached: 00000529-AUDIO-2021-11-11-13-25-40.opus>

[11/11/21 13:25:50] **Pau Fitz:** Ayyy el buen fin

[11/11/21 13:26:23] **Pau Fitz:** Déjame ver

[11/11/21 13:26:25] **Pau Fitz:** En Amazon

‎[11/11/21 13:26:26] **Alfonso Alvarez:** ‎<attached: 00000533-PHOTO-2021-11-11-13-26-25.jpg>

[11/11/21 13:26:47] **Pau Fitz:** Que padre está! Ese si

[11/11/21 13:27:56] **Pau Fitz:** El tapete de bebé no

[11/11/21 13:28:03] **Pau Fitz:** En Amazon está en 800 el mismo

[11/11/21 13:28:13] **Alfonso Alvarez:** Ok

[11/11/21 13:28:19] **Alfonso Alvarez:** El otro t gusto?

[11/11/21 13:28:23] **Alfonso Alvarez:** Blanco o gris?

[11/11/21 13:28:53] **Pau Fitz:** Si blanco

[11/11/21 13:29:40] **Pau Fitz:** Y pues las colas son por el buen fin

[11/11/21 13:31:54] **Alfonso Alvarez:** 🥴

[11/11/21 13:35:01] **Alfonso Alvarez:** Me marcas

‎[11/11/21 13:35:28] **Alfonso Alvarez:** ‎<attached: 00000544-PHOTO-2021-11-11-13-35-27.jpg>

‎[11/11/21 13:35:35] **Alfonso Alvarez:** ‎<attached: 00000545-PHOTO-2021-11-11-13-35-35.jpg>

‎[11/11/21 13:44:48] **Alfonso Alvarez:** ‎<attached: 00000546-PHOTO-2021-11-11-13-44-48.jpg>

‎[11/11/21 13:45:18] **Alfonso Alvarez:** ‎<attached: 00000547-AUDIO-2021-11-11-13-45-18.opus>

[11/11/21 13:54:58] **Pau Fitz:** A ok

[11/11/21 14:08:07] **Pau Fitz:** Amor le falta una hora todavía, acaban de pasar la caset de palmillas

[11/11/21 14:39:55] **Alfonso Alvarez:** Mándame el Tel de tu mamá o dígale q estoy afuera de figon (restoran) ☺️

‎[11/11/21 14:42:46] **Pau Fitz:** ‎<attached: 00000551-Verito.vcf>

[11/11/21 14:42:50] **Pau Fitz:** Le digo

[11/11/21 15:09:46] **Pau Fitz:** Me avisas cuando vengan

[11/11/21 15:10:06] **Pau Fitz:** Algo me escribió de que creo que ya llegó a qué va entrando pero escribió mal su cel no entiendo

[12/11/21 13:58:09] **Pau Fitz:** Ya vamos

[13/11/21 22:26:28] **Alfonso Alvarez:** https://youtu.be/dIrPCnpWtXA

[15/11/21 8:35:06] **Alfonso Alvarez:** https://www.walmart.com.mx/computadoras/laptops/todas-las-laptops/chromebook-dell-xdgjh-intel-trail-4gb-ram-16gb-emmc-reacondicionada_00085369520016?gclid=CjwKCAiAp8iMBhAqEiwAJb94z0SRwpJfCo0o-NNMnBxNSKlTV7LZLpDozbFOgM-KSNqFgXcdxFy3JxoC1uIQAvD_BwE

[15/11/21 8:35:19] **Alfonso Alvarez:** Para empezar igual y no está mal

[15/11/21 8:40:37] **Pau Fitz:** Que significa re acondicionado?

[15/11/21 8:41:01] **Alfonso Alvarez:** Yo creo q la tuvieron q reparar

[15/11/21 8:41:08] **Alfonso Alvarez:** X garantía o algo

[15/11/21 8:41:28] **Alfonso Alvarez:** Creo q no, hasta ahora q lo dije mejor la otra

[15/11/21 8:41:56] **Pau Fitz:** Si, mejor una nueva nueva, no hay más ?

[15/11/21 8:42:25] **Alfonso Alvarez:** https://www.googleadservices.com/pagead/aclk?sa=L&ai=DChcSEwiMjev7ypr0AhUVbm8EHX4fBfwYABALGgJqZg&ae=2&ohost=www.google.com&cid=CAESP-D2rwXqier91fnyBjEzXNrr1PT-21q8Ef6qvLFMHnMkXRSMwczGIR11aCmpGnEflaRAXQMIWdXxYwn8hp1NaA&sig=AOD64_1lsMs4KcgMoE7RYQSYyjIccWz5AA&ctype=5&q=&ved=2ahUKEwi4wOD7ypr0AhU4kWoFHWgLCOcQwg96BAgBECU&adurl=

[15/11/21 8:43:27] **Alfonso Alvarez:** https://www.walmart.com.mx/computadoras/laptops/todas-las-laptops/laptop-2-en-2-hyundai-hyflip-htlf11inc4z1es-intel-celeron-4gb-ram-64gb-emmc_00081003303556?gclid=CjwKCAiAp8iMBhAqEiwAJb94z_LTBATTW1KBu4lrPEMrH_eNc3BhTF6K8sF3jLFu0VGAmW-ujGNI2hoCP48QAvD_BwE

[15/11/21 8:44:00] **Alfonso Alvarez:** https://www.googleadservices.com/pagead/aclk?sa=L&ai=DChcSEwiMjev7ypr0AhUVbm8EHX4fBfwYABAPGgJqZg&ae=2&ohost=www.google.com&cid=CAESP-D2rwXqier91fnyBjEzXNrr1PT-21q8Ef6qvLFMHnMkXRSMwczGIR11aCmpGnEflaRAXQMIWdXxYwn8hp1NaA&sig=AOD64_1yhSgFAx4Rek-osfNPbYXmKD9MVw&ctype=5&q=&ved=2ahUKEwi4wOD7ypr0AhU4kWoFHWgLCOcQwg96BAgBED4&adurl=

[15/11/21 8:44:27] **Alfonso Alvarez:** https://www.googleadservices.com/pagead/aclk?sa=L&ai=DChcSEwiMjev7ypr0AhUVbm8EHX4fBfwYABAhGgJqZg&ae=2&ohost=www.google.com&cid=CAESP-D2rwXqier91fnyBjEzXNrr1PT-21q8Ef6qvLFMHnMkXRSMwczGIR11aCmpGnEflaRAXQMIWdXxYwn8hp1NaA&sig=AOD64_0HAiqI-GsN7HEXAzWwiIvp3nvb8g&ctype=5&q=&ved=2ahUKEwi4wOD7ypr0AhU4kWoFHWgLCOcQwg96BAgBEFc&adurl=

[15/11/21 8:44:51] **Alfonso Alvarez:** https://www.googleadservices.com/pagead/aclk?sa=L&ai=DChcSEwiMjev7ypr0AhUVbm8EHX4fBfwYABAuGgJqZg&ae=2&ohost=www.google.com&cid=CAESP-D2rwXqier91fnyBjEzXNrr1PT-21q8Ef6qvLFMHnMkXRSMwczGIR11aCmpGnEflaRAXQMIWdXxYwn8hp1NaA&sig=AOD64_1v4_0woqmjjqjUSR74WpHGY2KWTw&ctype=5&q=&ved=2ahUKEwi4wOD7ypr0AhU4kWoFHWgLCOcQwg96BAgBEGw&adurl=

[15/11/21 8:45:53] **Alfonso Alvarez:** https://www.walmart.com.mx/computadoras/computadoras-de-escritorio/todas-las-computadoras-de-escritorio/hp-chromebook-intel-celeron-n4000-4-gb-ram-32-gb-emmc-llevate-de-regalo-3-usb-de-32gb-hp-9rt87ua-aba_00046726185593?gclid=CjwKCAiAp8iMBhAqEiwAJb94z1w7jUDE_M4Rb0yrjfdbFONYTfBcrWkx3jreneE6rIRAJsm7P56KKBoC2tMQAvD_BwE

[15/11/21 8:48:40] **Pau Fitz:** Creo que la primera hp, la asus o lenovo

[15/11/21 8:48:56] **Pau Fitz:** Asus

[15/11/21 8:49:24] **Pau Fitz:** Lenovo

[15/11/21 8:49:37] **Pau Fitz:** Hp

[15/11/21 8:51:48] **Pau Fitz:** La lenovo ya trae office y puede que ocupe mucho espacio

[15/11/21 9:56:18] **Pau Fitz:** https://www.sams.com.mx/laptops/laptop-asus-vivobook-celeron-4-gb-ram-128-gb-ssd/980029841
Asus sams

‎[15/11/21 12:52:02] **Alfonso Alvarez:** ‎<attached: 00000576-PHOTO-2021-11-15-12-52-02.jpg>

[15/11/21 16:53:08] **Pau Fitz:** *Ya puedo regresar a tu casa ?*

[15/11/21 16:53:50] **Alfonso Alvarez:** *De verdad no t entiendo y no se q t pasa*

[15/11/21 16:54:51] **Pau Fitz:** *De que ?*

[15/11/21 16:55:13] **Pau Fitz:** *Me regañas porque bajo en toalla en mi casa corriendo por un biberón*

[15/11/21 16:55:16] **Pau Fitz:** *Eso que ?*

[15/11/21 16:57:37] **Pau Fitz:** *Al parecer ya todo lo que haga te caga*

[15/11/21 16:57:53] **Pau Fitz:** *Ya casi regresamos porque hace frío para que Gaia ande en la calle*

[16/11/21 8:39:43] **Alfonso Alvarez:** Para el vídeo introductorio 
https://youtu.be/LqFHN_kVBjo

‎[17/11/21 12:52:26] **Pau Fitz:** ‎<attached: 00000585-PHOTO-2021-11-17-12-52-26.jpg>

[17/11/21 18:56:45] **Pau Fitz:** *Te enojaste ?*

[17/11/21 18:56:55] **Alfonso Alvarez:** *Nooo*

[17/11/21 18:57:00] **Alfonso Alvarez:** 😘

[17/11/21 18:57:03] **Alfonso Alvarez:** *X?*

[17/11/21 18:57:13] **Alfonso Alvarez:** *Ah ya se me había olvidado*

[17/11/21 18:57:16] **Alfonso Alvarez:** ☺️

[17/11/21 18:57:18] **Pau Fitz:** *Por el dinero*
[17/11/21 18:57:27] **Alfonso Alvarez:** *Nooo no pasa nada*

[17/11/21 18:57:33] **Pau Fitz:** *Solo agarre 400*

[17/11/21 18:57:45] **Alfonso Alvarez:** *Si amor no t preocupes es tu dinero 😘*

[17/11/21 18:58:00] **Alfonso Alvarez:** *Me daba hueva ir al banco pero hay más de lo q necesito*

[17/11/21 18:58:51] **Pau Fitz:** *Bueno perdón te amo*

[17/11/21 18:59:07] **Alfonso Alvarez:** *No amor no le pidas perdón t amo*

‎[17/11/21 19:01:09] **Alfonso Alvarez:** ‎<attached: 00000599-PHOTO-2021-11-17-19-01-09.jpg>

[17/11/21 19:25:30] **Pau Fitz:** 2 ebooks

‎[18/11/21 11:15:44] **Alfonso Alvarez:** ‎<attached: 00000601-PHOTO-2021-11-18-11-15-44.jpg>

[18/11/21 11:15:54] **Alfonso Alvarez:** Salió 😘

[18/11/21 11:16:12] **Pau Fitz:** Súper ! 😍 ando hablando con tu mamá

[18/11/21 11:16:42] **Alfonso Alvarez:** Salúdala y disfruta con mi bebe 😘

‎[19/11/21 17:45:28] **Pau Fitz:** ‎<attached: 00000605-PHOTO-2021-11-19-17-45-28.jpg>

‎[19/11/21 17:45:29] **Pau Fitz:** ‎<attached: 00000606-PHOTO-2021-11-19-17-45-29.jpg>

‎[19/11/21 17:45:29] **Pau Fitz:** ‎<attached: 00000607-PHOTO-2021-11-19-17-45-29.jpg>

‎[19/11/21 17:45:32] **Pau Fitz:** ‎<attached: 00000608-VIDEO-2021-11-19-17-45-32.mp4>

‎[20/11/21 16:58:38] **Alfonso Alvarez:** ‎<attached: 00000609-VIDEO-2021-11-20-16-58-38.mp4>

‎[20/11/21 18:24:55] **Pau Fitz:** ‎<attached: 00000610-PHOTO-2021-11-20-18-24-55.jpg>

[20/11/21 18:25:07] **Alfonso Alvarez:** 👌🏼

[20/11/21 21:57:15] **Pau Fitz:** https://youtu.be/S-gmN19QMPQ

[21/11/21 13:59:36] **Pau Fitz:** https://youtu.be/NvqSKR6qIps

‎[22/11/21 8:42:37] **Alfonso Alvarez:** ‎<attached: 00000624-PHOTO-2021-11-22-08-42-36.jpg>

‎[22/11/21 8:42:38] **Alfonso Alvarez:** ‎<attached: 00000626-PHOTO-2021-11-22-08-42-38.jpg>

‎[22/11/21 8:42:38] **Alfonso Alvarez:** ‎<attached: 00000627-PHOTO-2021-11-22-08-42-38.jpg>

‎[22/11/21 8:42:40] **Alfonso Alvarez:** ‎<attached: 00000628-VIDEO-2021-11-22-08-42-40.mp4>

‎[22/11/21 8:42:40] **Alfonso Alvarez:** ‎<attached: 00000629-PHOTO-2021-11-22-08-42-40.jpg>

‎[22/11/21 8:42:41] **Alfonso Alvarez:** ‎<attached: 00000630-PHOTO-2021-11-22-08-42-40.jpg>

‎[22/11/21 8:42:41] **Alfonso Alvarez:** ‎<attached: 00000631-PHOTO-2021-11-22-08-42-41.jpg>

‎[22/11/21 8:42:42] **Alfonso Alvarez:** ‎<attached: 00000632-PHOTO-2021-11-22-08-42-42.jpg>

‎[22/11/21 8:42:42] **Alfonso Alvarez:** ‎<attached: 00000633-PHOTO-2021-11-22-08-42-42.jpg>

‎[22/11/21 8:42:43] **Alfonso Alvarez:** ‎<attached: 00000634-PHOTO-2021-11-22-08-42-43.jpg>

‎[22/11/21 8:42:43] **Alfonso Alvarez:** ‎<attached: 00000635-PHOTO-2021-11-22-08-42-43.jpg>

[22/11/21 19:11:25] **Pau Fitz:** ‎Missed voice call

[23/11/21 11:05:32] **Pau Fitz:** A lo mejor es reflujo ☹️ le mando el dr un jarabe

[23/11/21 11:09:52] **Alfonso Alvarez:** Ok, me imagine la verdad

[23/11/21 11:10:08] **Alfonso Alvarez:** Mándame el nombre y lo compro de regreso

[23/11/21 11:41:27] **Pau Fitz:** Cisaprida suspensión es el activo y si no hay compras unamol suspensión y un sterimar bebé plis, lo iba a pedir a la san  pablo pero no tienen

[23/11/21 11:41:54] **Pau Fitz:** Gracias amor

[23/11/21 12:06:35] **Alfonso Alvarez:** Ok amor 😘

[23/11/21 13:24:37] **Alfonso Alvarez:** -La salida es hacia adentro
-Volver a ti

[23/11/21 16:02:45] **Pau Fitz:** Amor de una vez puedes comprar otras leches

[23/11/21 19:07:04] **Pau Fitz:** Me mando mensaje Walmart que el pedido Salió del almacén hoy a ruta de entrega

[23/11/21 19:07:25] **Alfonso Alvarez:** Ok

[23/11/21 19:07:43] **Alfonso Alvarez:** Crees q todavía puedan entregar hoy?

[23/11/21 19:08:18] **Pau Fitz:** A veces wnregan hasta las 8 🥴 pero no creo

[23/11/21 19:08:30] **Pau Fitz:** Me hubieran marcado

[23/11/21 19:08:41] **Alfonso Alvarez:** Bueno pero estoy al pendiente por cualquier cosa

[23/11/21 19:08:50] **Pau Fitz:** Sip 😘

[23/11/21 19:11:45] **Alfonso Alvarez:** 😘

[24/11/21 9:31:11] **Pau Fitz:** Me ayudas?

[24/11/21 9:31:30] **Pau Fitz:** Ya no

[25/11/21 17:52:02] **Alfonso Alvarez:** https://youtu.be/aT1aZvebGA8

[26/11/21 11:21:25] **Pau Fitz:** Todo bien amor ?

[26/11/21 12:08:44] **Alfonso Alvarez:** Siiii

‎[26/11/21 12:08:51] **Alfonso Alvarez:** ‎<attached: 00000660-PHOTO-2021-11-26-12-08-51.jpg>

[26/11/21 12:09:15] **Alfonso Alvarez:** Ya le cambie pipí y pops y metimos los pañales a lavar

[26/11/21 12:09:22] **Alfonso Alvarez:** Se tomó casi 3 oz

[26/11/21 12:10:03] **Pau Fitz:** Súper gracias mi amor

[26/11/21 12:10:28] **Alfonso Alvarez:** No de nada 😘

[26/11/21 12:50:12] **Pau Fitz:** Ya voy amor

[26/11/21 12:57:31] **Alfonso Alvarez:** Esta dormida

[26/11/21 18:59:25] **Pau Fitz:** Amor

[26/11/21 18:59:39] **Alfonso Alvarez:** Voy

[26/11/21 18:59:46] **Pau Fitz:** Puedes venir a apagar la luz

[26/11/21 18:59:49] **Pau Fitz:** Plis

[26/11/21 19:00:42] **Alfonso Alvarez:** X eso no me fui 😘

[26/11/21 19:01:07] **Pau Fitz:** Gracias mi amor 🥰

[28/11/21 18:59:40] **Pau Fitz:** Amor mándame la canalización plis

[28/11/21 19:43:28] **Alfonso Alvarez:** https://youtu.be/abA6oPZYRVQ

‎[29/11/21 10:23:30] **Pau Fitz:** ‎<attached: 00000675-PHOTO-2021-11-29-10-23-30.jpg>

[29/11/21 11:36:24] **Alfonso Alvarez:** 😳

[30/11/21 14:30:01] **Pau Fitz:** https://www.amazon.com.mx/tazones-cucharas-Papubaby-alimenticio-succión/dp/B08DDD8C1G/ref=mp_s_a_1_7?crid=1BKUQB1ZTLGBN&keywords=platos+para+bebe&qid=1638304129&sprefix=plato%2Caps%2C167&sr=8-7

[30/11/21 19:22:35] **Pau Fitz:** Amor

[30/11/21 19:22:42] **Pau Fitz:** Se oye mucho

[30/11/21 19:22:50] **Pau Fitz:** Ya está dormida

[30/11/21 19:23:10] **Alfonso Alvarez:** Sorry 🙈

[30/11/21 19:23:58] **Alfonso Alvarez:** Voy a comprar una salsa xq no hay y no tenemos jitomate

[01/12/21 7:21:06] **Alfonso Alvarez:** https://youtu.be/8_RnUlMF7eo

[01/12/21 17:31:50] **Pau Fitz:** CLABE Interbancaria: 646180132800000009
Banco destino: STP
Nombre del beneficiario: PayU
[01/12/21 17:32:24] **Pau Fitz:** Número de referencia del SPEI
372376

[01/12/21 21:09:45] **Pau Fitz:** Amor puedes apagar el monitor cuando regreses Plis

[02/12/21 7:53:58] **Alfonso Alvarez:** Me quede atorado afuera 🥰

[02/12/21 7:54:02] **Alfonso Alvarez:** 🙈

[02/12/21 7:54:13] **Alfonso Alvarez:** Cuando se quede dormida me ayudas si quieres 😘

[02/12/21 11:43:06] **Alfonso Alvarez:** https://youtu.be/x61g5Hh2XxA

[02/12/21 14:10:20] **Pau Fitz:** Amor ya abriste?

[02/12/21 14:10:47] **Alfonso Alvarez:** No

[02/12/21 14:12:22] **Alfonso Alvarez:** Ya ☺️😅

[02/12/21 14:12:32] **Alfonso Alvarez:** Llego su platito 🥰

[02/12/21 14:12:52] **Pau Fitz:** Yujuu pensé que era el plomero

[02/12/21 14:13:05] **Alfonso Alvarez:** Yo también

[02/12/21 14:13:30] **Alfonso Alvarez:** Q vamos a comer?

[02/12/21 14:13:35] **Alfonso Alvarez:** 🙄

[02/12/21 14:13:42] **Alfonso Alvarez:** 🥸

[02/12/21 14:13:53] **Pau Fitz:** Queso en salsa sr. 😘

[02/12/21 14:14:03] **Alfonso Alvarez:** 👴🏽

[02/12/21 14:14:07] **Alfonso Alvarez:** Ok

‎[02/12/21 14:46:53] **Pau Fitz:** doc02-12-2021_0_2.46.42.683 p.m..pdf • ‎1 page ‎<attached: 00000703-doc02-12-2021_0_2.46.42.683 p.m..pdf>

[03/12/21 8:15:24] **Alfonso Alvarez:** https://youtu.be/TXkOhGKTE_E

[03/12/21 9:58:21] **Alfonso Alvarez:** https://youtu.be/NaUkxdxFxKw

[03/12/21 11:42:40] **Pau Fitz:** 2,929.5 pago Caligrama 
info@caligramaeditorial.com

[03/12/21 12:03:24] **Alfonso Alvarez:** Rato

[03/12/21 12:03:48] **Pau Fitz:** Cómo?

[03/12/21 20:46:47] **Alfonso Alvarez:** https://youtu.be/_5PN0DfcduI

[03/12/21 21:06:33] **Pau Fitz:** Amor apagas la cámara plis

[03/12/21 21:07:11] **Alfonso Alvarez:** RT

[03/12/21 21:07:19] **Alfonso Alvarez:** Rogar that 😘

[04/12/21 19:41:48] **Pau Fitz:** Amor me ayudas a hacer otra mamila

[04/12/21 19:41:56] **Pau Fitz:** Aquí arriba hay todo

[04/12/21 19:42:02] **Alfonso Alvarez:** Voy

[04/12/21 19:42:02] **Pau Fitz:** Plis

[04/12/21 19:42:47] **Alfonso Alvarez:** Cual agrro? Todas tienen poca agua

[04/12/21 19:42:58] **Pau Fitz:** Ponle más a una

[04/12/21 19:43:05] **Pau Fitz:** Y esa

[05/12/21 8:21:49] **Alfonso Alvarez:** https://youtu.be/CLPQ4VEMW5M

[06/12/21 10:38:25] **Alfonso Alvarez:** Esta dormida

[06/12/21 10:38:30] **Alfonso Alvarez:** Ya vi q pagaste 😘

‎[06/12/21 10:39:12] **Pau Fitz:** ‎<attached: 00000723-AUDIO-2021-12-06-10-39-12.opus>

[06/12/21 10:39:38] **Alfonso Alvarez:** Ok amor 😘

[06/12/21 11:00:08] **Alfonso Alvarez:** Listo

[06/12/21 11:02:54] **Alfonso Alvarez:** Ya t deposite x cualquier cosa

[06/12/21 11:03:59] **Alfonso Alvarez:** Ya me llego el cargo, justo tenia 1,037 🙈

‎[07/12/21 15:27:09] **Pau Fitz:** ‎<attached: 00000728-PHOTO-2021-12-07-15-27-09.jpg>

‎[07/12/21 15:27:10] **Pau Fitz:** ‎<attached: 00000729-PHOTO-2021-12-07-15-27-10.jpg>

‎[07/12/21 15:27:11] **Pau Fitz:** ‎<attached: 00000730-PHOTO-2021-12-07-15-27-11.jpg>

‎[07/12/21 15:27:11] **Pau Fitz:** ‎<attached: 00000731-PHOTO-2021-12-07-15-27-11.jpg>

‎[07/12/21 16:08:22] **Pau Fitz:** ‎<attached: 00000732-PHOTO-2021-12-07-16-08-22.jpg>

‎[07/12/21 21:13:59] **Pau Fitz:** ‎<attached: 00000733-Juan Albañil Artessa Mtto.vcf>

‎[08/12/21 8:48:13] **Pau Fitz:** paymentInstructions-3.pdf • ‎1 page ‎<attached: 00000734-paymentInstructions-3.pdf>

[08/12/21 8:53:32] **Alfonso Alvarez:** https://youtu.be/lWQuS-u_XAI

[08/12/21 13:33:41] **Pau Fitz:** Llevamos un pantalón y blusa un pañal y una mamila 🥴 se está portando súper pero hizo popó le dio hambre y estamos sentadas tomando lechita

‎[08/12/21 13:35:05] **Pau Fitz:** ‎<attached: 00000737-PHOTO-2021-12-08-13-35-05.jpg>

[08/12/21 13:51:55] **Alfonso Alvarez:** Q Bueno mi amor disfruten 🥰

[08/12/21 13:52:01] **Alfonso Alvarez:** Nosotros apenas acabamos

‎[08/12/21 13:52:25] **Alfonso Alvarez:** ‎<attached: 00000740-PHOTO-2021-12-08-13-52-25.jpg>

[08/12/21 14:39:30] **Pau Fitz:** Fuchi jajaj ya vamos estamos formadas para la gasolina

[08/12/21 14:39:53] **Alfonso Alvarez:** Ok 🥰

‎[08/12/21 17:21:47] **Alfonso Alvarez:** ‎<attached: 00000743-PHOTO-2021-12-08-17-21-47.jpg>

‎[08/12/21 17:21:48] **Alfonso Alvarez:** ‎<attached: 00000744-PHOTO-2021-12-08-17-21-48.jpg>

[09/12/21 7:43:16] **Alfonso Alvarez:** Amor, me quede afuera 😬

[09/12/21 7:43:45] **Alfonso Alvarez:** No t enojes 🙈

[10/12/21 8:17:34] **Alfonso Alvarez:** El dominio mundial: Elementos del poder y claves geopolíticas (Ariel) https://www.amazon.com.mx/dp/B07JCR8FTZ/ref=cm_sw_r_wa_api_glt_880F9T97ERXXA3685YZE

[10/12/21 8:17:57] **Alfonso Alvarez:** El dominio mental: La geopolítica de la mente (Ariel) https://www.amazon.com.mx/dp/B08JF1LK7D/ref=cm_sw_r_wa_api_glt_P1H72WN3PVQ9YZVNSG6Z

[10/12/21 8:18:46] **Alfonso Alvarez:** Así se domina el mundo: Desvelando las claves del poder mundial (Ariel) https://www.amazon.com.mx/dp/B076MGXCNQ/ref=cm_sw_r_wa_api_glt_BSPNP0WEAMV93Y1FXT94

‎[10/12/21 11:09:56] **Alfonso Alvarez:** ‎<attached: 00000750-VIDEO-2021-12-10-11-09-56.mp4>

‎[10/12/21 11:10:31] **Alfonso Alvarez:** ‎<attached: 00000751-VIDEO-2021-12-10-11-10-31.mp4>

‎[10/12/21 11:17:15] **Alfonso Alvarez:** ‎<attached: 00000752-VIDEO-2021-12-10-11-17-15.mp4>

[10/12/21 11:17:19] **Pau Fitz:** Mmmmm

[10/12/21 11:17:33] **Pau Fitz:** Se escucha muchísimo ruido atrás

[10/12/21 11:19:06] **Pau Fitz:** No me encanta, a ti ?

[10/12/21 11:21:33] **Alfonso Alvarez:** T puedo marcar?

[10/12/21 11:25:39] **Pau Fitz:** Si estoy hablando con tu mamá

[10/12/21 11:27:09] **Alfonso Alvarez:** Ah ok tú me dices

[10/12/21 11:27:25] **Alfonso Alvarez:** Pra q t cuente como va a quedar pero es como dijimos

[10/12/21 11:27:35] **Pau Fitz:** Ok sale

[10/12/21 11:59:08] **Pau Fitz:** Ya amor

[10/12/21 11:59:19] **Pau Fitz:** Qué hago? Te marcó ?

[10/12/21 11:59:28] **Alfonso Alvarez:** Si xfa

[10/12/21 15:08:07] **Alfonso Alvarez:** https://youtu.be/9iprI7tdSEo

‎[10/12/21 19:16:26] **Pau Fitz:** ‎<attached: 00000765-Guadalupe Soto Tecnico LG.vcf>

[12/12/21 20:44:25] **Alfonso Alvarez:** https://docs.google.com/spreadsheets/d/1dP4bP-ZZkCNYpik7qgtqWz4KfKiEuJjKplJDLuA_UoU/edit?usp=sharing

[12/12/21 21:25:08] **Alfonso Alvarez:** Pensé q t habías subidón dormir 🙈

[12/12/21 21:26:23] **Pau Fitz:** Si, pero estaba despierta la bebita

[12/12/21 21:26:42] **Pau Fitz:** Me espantaste horrible 🥴

[12/12/21 21:42:16] **Pau Fitz:** Amor le dejas la puerta del cuarto un poquito abierta cuando subas plis

[13/12/21 9:51:18] **Pau Fitz:** Amor me ayudas a calentar la leche que está en el refri plis

[13/12/21 9:52:01] **Alfonso Alvarez:** Si

[13/12/21 9:52:10] **Pau Fitz:** Gracias

[13/12/21 16:48:22] **Alfonso Alvarez:** All clear mam 🥸

[13/12/21 16:48:47] **Alfonso Alvarez:** No huele y ya metí la colcha ahora huele a las toallas esas ☺️

‎[13/12/21 16:48:51] **Pau Fitz:** ‎<attached: 00000776-PHOTO-2021-12-13-16-48-51.jpg>

[13/12/21 16:48:58] **Alfonso Alvarez:** 🥰

[13/12/21 16:49:01] **Pau Fitz:** Yujuuu gracias amor

[13/12/21 16:49:18] **Pau Fitz:** Ya voy de regreso

[13/12/21 16:59:38] **Pau Fitz:** Ya voy q llegar

[13/12/21 16:59:41] **Pau Fitz:** Me abres

[13/12/21 16:59:49] **Pau Fitz:** Y prendes el ventilador plis

[13/12/21 17:03:02] **Pau Fitz:** Amor ya llegamos

[14/12/21 11:17:03] **Pau Fitz:** http://maps.google.com/?q=20.675914,-100.337105&q=20.6759140,-100.3371040&hl=es-MX&gl=mx&entry=gps&lucs=swa,s2se

[15/12/21 14:21:37] **Alfonso Alvarez:** Me mandas la lista xfa 😅

[16/12/21 13:44:08] **Alfonso Alvarez:** Me abres xfa

[16/12/21 19:45:18] **Alfonso Alvarez:** https://youtu.be/bpJV08-EuuQ

[17/12/21 8:38:19] **Alfonso Alvarez:** ‎Location: https://maps.google.com/?q=20.675964,-100.337135

[17/12/21 10:05:43] **Pau Fitz:** Amor cualquier cosa me avisas porfa

[17/12/21 11:03:03] **Alfonso Alvarez:** Si amor, estoy cargando gasolina, hubo un accidente y estuve parado

[17/12/21 11:07:22] **Pau Fitz:** Con razón venia que no te movías

[17/12/21 11:07:33] **Pau Fitz:** Ok te amo con cuidado

[17/12/21 12:20:08] **Pau Fitz:** Ya llegaron los libros y vi que si pudiste agarrar el 2do piso 🎉

[17/12/21 13:23:39] **Alfonso Alvarez:** Ya llegue a tabachines amor

[17/12/21 13:23:58] **Alfonso Alvarez:** Me voy a bañar 😘

‎[17/12/21 13:30:58] **Alfonso Alvarez:** ‎<attached: 00000796-PHOTO-2021-12-17-13-30-57.jpg>

‎[17/12/21 14:05:41] **Alfonso Alvarez:** ‎<attached: 00000797-PHOTO-2021-12-17-14-05-41.jpg>

[17/12/21 14:05:48] **Alfonso Alvarez:** https://drive.google.com/drive/folders/1VDPS6EZX1i6JgpTC5u9gqZ1HHotq4sDD?usp=sharing

[17/12/21 14:23:07] **Pau Fitz:** Jajajaja hace mucho que no la veo! Perdón no me habían llegado

[17/12/21 14:23:32] **Pau Fitz:** Ok lo voy a checar

[17/12/21 14:23:42] **Pau Fitz:** Todo bien en el camino verdad

[17/12/21 14:24:56] **Pau Fitz:** Solo puedo ver el guion en el link ☹️

[17/12/21 14:25:15] **Pau Fitz:** Te amo

[17/12/21 16:13:43] **Alfonso Alvarez:** Si, ya le dije

[17/12/21 16:14:00] **Alfonso Alvarez:** Si amor, ustedes como van?

‎[17/12/21 16:15:36] **Pau Fitz:** ‎<attached: 00000806-PHOTO-2021-12-17-16-15-36.jpg>

[17/12/21 16:15:49] **Alfonso Alvarez:** 🥰😘

[17/12/21 16:16:09] **Alfonso Alvarez:** Con cuidado 👴🏽

‎[17/12/21 16:18:53] **Pau Fitz:** ‎<attached: 00000809-AUDIO-2021-12-17-16-18-53.opus>
